{"pattern_id":"Classic_012_A","version":1,"columns":4,"rows":3,"aspect_ratio":1.6,"aspect_ratio_class":"landscape_16_10","style":"classic_ribbon","curve":{"type":"catmull_rom","version":1,"samples_per_span":4},"authoring":{"generator_version":1,"seed":424242,"template":"classic_cardboard_v1","curated":true},"intersections":[[0.0,0.0],[0.25003324,0.0],[0.49794976,0.0],[0.75151985,0.0],[1.0,0.0],[0.0,0.33103631],[0.24880909,0.33690197],[0.50286111,0.33536016],[0.74885493,0.33236747],[1.0,0.33286874],[0.0,0.66322378],[0.25170487,0.66830124],[0.49944765,0.66350771],[0.7507688,0.66192519],[1.0,0.66728321],[0.0,1.0],[0.24938757,1.0],[0.50124086,1.0],[0.75350844,1.0],[1.0,1.0]],"horizontal_segments":[[[0.0,0.0],[0.25003324,0.0]],[[0.25003324,0.0],[0.49794976,0.0]],[[0.49794976,0.0],[0.75151985,0.0]],[[0.75151985,0.0],[1.0,0.0]],[[0.0,0.33103631],[0.06827912,0.33253486],[0.08280774,0.33286186],[0.09368521,0.33516918],[0.10179143,0.32280958],[0.09805162,0.30811803],[0.11097826,0.29830525],[0.12915956,0.29648488],[0.14730224,0.29916529],[0.16004454,0.30958573],[0.15603524,0.32409385],[0.16391157,0.33683176],[0.17482849,0.33504019],[0.18935905,0.3354006],[0.24880909,0.33690197]],[[0.24880909,0.33690197],[0.31442669,0.3367552],[0.32998514,0.33670178],[0.34165869,0.33865102],[0.35018698,0.32645294],[0.34600452,0.31231642],[0.35972453,0.30244934],[0.37916731,0.30015999],[0.39789536,0.30221156],[0.41114941,0.31191166],[0.40718876,0.32609849],[0.41545564,0.33819289],[0.42668459,0.33610286],[0.44166282,0.33596961],[0.50286111,0.33536016]],[[0.50286111,0.33536016],[0.56330805,0.33438912],[0.57855192,0.3341613],[0.58997575,0.3320821],[0.59841536,0.34363082],[0.59441484,0.35726682],[0.60792502,0.36648651],[0.62699,0.36833499],[0.64612631,0.36602388],[0.65961169,0.3564773],[0.6554626,0.34293999],[0.66383156,0.33118774],[0.6753285,0.33298936],[0.69064566,0.332847],[0.74885493,0.33236747]],[[0.74885493,0.33236747],[0.81511263,0.332529],[0.83025728,0.33256376],[0.84161724,0.33069428],[0.8499378,0.34225315],[0.84588875,0.35567998],[0.85925927,0.36501],[0.87818847,0.36711546],[0.89786095,0.36508606],[0.91176894,0.35580971],[0.90758297,0.34236668],[0.91624714,0.33084123],[0.92804819,0.33275625],[0.94378488,0.33278223],[1.0,0.33286874]],[[0.0,0.66322378],[0.05841627,0.66466713],[0.0731289,0.66501362],[0.08418024,0.66313357],[0.09216988,0.67630722],[0.08812729,0.69134502],[0.10104109,0.70210287],[0.11941389,0.70481815],[0.13735432,0.70284958],[0.15010187,0.69261961],[0.14639764,0.67742245],[0.15438581,0.66457747],[0.16512242,0.66690555],[0.17946038,0.66715585],[0.25170487,0.66830124]],[[0.25170487,0.66830124],[0.30566164,0.66672706],[0.32106292,0.66631301],[0.33263037,0.6681845],[0.34100151,0.65478452],[0.33677833,0.63952378],[0.35030277,0.62857019],[0.3695373,0.62579511],[0.38804242,0.62780916],[0.40118733,0.63822364],[0.39735939,0.65364719],[0.40559368,0.66671135],[0.41667001,0.66438196],[0.43146045,0.66418641],[0.49944765,0.66350771]],[[0.49944765,0.66350771],[0.55774588,0.66250422],[0.57338763,0.66227935],[0.58512419,0.66424476],[0.59369552,0.65126272],[0.58948746,0.63631047],[0.60327893,0.62578193],[0.62282574,0.6233166],[0.64187236,0.62552498],[0.65535358,0.63587066],[0.65132837,0.6508782],[0.65973815,0.66374614],[0.67115764,0.66162487],[0.68639063,0.6616419],[0.7507688,0.66192519]],[[0.7507688,0.66192519],[0.8090033,0.66315982],[0.82358444,0.66347007],[0.83453665,0.66175627],[0.84245669,0.67378618],[0.83845245,0.68750875],[0.85125219,0.69734182],[0.86946076,0.6998565],[0.88809477,0.69813306],[0.90133046,0.68885918],[0.89747494,0.67496779],[0.90576564,0.66328608],[0.91691898,0.66547474],[0.9318119,0.66579772],[1.0,0.66728321]],[[0.0,1.0],[0.24938757,1.0]],[[0.24938757,1.0],[0.50124086,1.0]],[[0.50124086,1.0],[0.75350844,1.0]],[[0.75350844,1.0],[1.0,1.0]]],"vertical_segments":[[[0.0,0.0],[0.0,0.33103631]],[[0.25003324,0.0],[0.25023488,0.08393654],[0.2502479,0.10408791],[0.25160474,0.11921396],[0.24330636,0.13021995],[0.23366433,0.1247566],[0.22695796,0.14249448],[0.2254027,0.16766907],[0.22678072,0.19207984],[0.23336319,0.20938228],[0.24304251,0.20426742],[0.25126407,0.215079],[0.24980302,0.22970417],[0.24965182,0.24922112],[0.24880909,0.33690197]],[[0.49794976,0.0],[0.49897719,0.0783696],[0.49925173,0.0986898],[0.50073116,0.11388221],[0.49315013,0.1253482],[0.48406784,0.12026724],[0.47808453,0.13845017],[0.47706396,0.16390155],[0.47882756,0.18943412],[0.48533615,0.20727984],[0.49425984,0.20148423],[0.502168,0.21245117],[0.50113482,0.22784911],[0.50145562,0.24831604],[0.50286111,0.33536016]],[[0.75151985,0.0],[0.7505033,0.08179738],[0.75028566,0.10126597],[0.75142649,0.11589418],[0.74343257,0.12644028],[0.73430271,0.12106006],[0.72778038,0.13812739],[0.72615552,0.16243536],[0.72738309,0.18677017],[0.73362483,0.20407708],[0.74283937,0.19908016],[0.75065867,0.20993689],[0.74927993,0.22449436],[0.74918085,0.24394001],[0.74885493,0.33236747]],[[1.0,0.0],[1.0,0.33286874]],[[0.0,0.33103631],[0.0,0.66322378]],[[0.24880909,0.33690197],[0.25017945,0.43063145],[0.25042409,0.45024189],[0.24932238,0.46497846],[0.25718106,0.47559142],[0.2661394,0.47016012],[0.27255672,0.48734395],[0.27416157,0.51182793],[0.27295421,0.53626605],[0.26681886,0.55365381],[0.25777526,0.5486484],[0.25009257,0.55956115],[0.25143533,0.57417778],[0.25151446,0.59370489],[0.25170487,0.66830124]],[[0.50286111,0.33536016],[0.50157361,0.41744506],[0.50128378,0.43797785],[0.49989844,0.45334635],[0.50694758,0.46483134],[0.51538814,0.45957864],[0.52096444,0.47787126],[0.5219722,0.50357373],[0.52044439,0.52878422],[0.51449956,0.54647007],[0.50617035,0.54086135],[0.49889144,0.55177803],[0.4999628,0.56695727],[0.49983277,0.58715474],[0.49944765,0.66350771]],[[0.74885493,0.33236747],[0.7490933,0.41034587],[0.74916394,0.42905081],[0.75053649,0.44305989],[0.74257653,0.45346652],[0.73323389,0.44861716],[0.72685867,0.46523556],[0.72554686,0.48863754],[0.72712305,0.51274272],[0.73368602,0.52969603],[0.74297189,0.52441054],[0.75104904,0.53490705],[0.74983691,0.54940224],[0.7499814,0.56870298],[0.7507688,0.66192519]],[[1.0,0.33286874],[1.0,0.66728321]],[[0.0,0.66322378],[0.0,1.0]],[[0.25170487,0.66830124],[0.25100418,0.74884874],[0.25084467,0.76824128],[0.24954316,0.78276454],[0.25668037,0.79355966],[0.26512604,0.7885386],[0.27081447,0.80577293],[0.27193112,0.83003714],[0.27046393,0.85545711],[0.26452853,0.87333294],[0.25615735,0.86775471],[0.24886656,0.87882064],[0.24995903,0.89410791],[0.24984052,0.91446275],[0.24938757,1.0]],[[0.49944765,0.66350771],[0.5000741,0.7462572],[0.50021064,0.76594061],[0.49907624,0.78072004],[0.50664939,0.79144362],[0.51535276,0.78607548],[0.52150822,0.80338016],[0.52299234,0.8279665],[0.52177514,0.85274558],[0.5158081,0.8703258],[0.50704787,0.86516265],[0.49959196,0.87615986],[0.50088607,0.89099969],[0.5009621,0.91080863],[0.50124086,1.0]],[[0.7507688,0.66192519],[0.75177772,0.74056502],[0.75201485,0.76099583],[0.75093817,0.77634496],[0.75863306,0.78742498],[0.76739965,0.78179359],[0.77368748,0.79971471],[0.77527373,0.82522646],[0.77410773,0.84989112],[0.76811775,0.86742798],[0.75926119,0.86235508],[0.7517519,0.87335267],[0.75308179,0.88810936],[0.75318213,0.90781965],[0.75350844,1.0]],[[1.0,0.66728321],[1.0,1.0]]],"validation_metadata":{"validated":true,"piece_self_intersections":0,"segment_self_intersections":0,"min_neck_width_ratio":0.21527,"max_knob_depth_ratio":0.118749,"min_knob_center_ratio":0.473089,"max_knob_center_ratio":0.529448}}